id,section,key,description,value,created_at,updated_at
82,learning,drawer:learn_improve_next_time,Drawer > Learn Improve Next Time,"Learn & Improve for Next Time is a description of the lesson(s) learned. Include what you would want to do the next time you encounter a similar situation, so that you and your project team can continue to improve on project results.",2021-11-04 12:23:38,2021-11-12 07:25:54
83,dashboard,table:gyr,Table > Gyr,"This chart shows the color of the Overall Project Status and the % of time passed, in the overall project, from the start of the project until today's date",2022-01-06 00:45:25,2024-01-17 04:42:24
84,dashboard,table:past_due_actions_count,Table > Past Due Actions Count,The number of Actions that are currently Past Due in this project,2022-01-06 00:45:25,2022-01-06 13:11:24
85,dashboard,new_project:project_name,New Project > Project Name,Give the project a name that is recognized by the team members and anyone seeing your reports. This can be edited at any time in the Project Information area.,2022-01-06 00:45:25,2022-01-06 13:21:49
86,dashboard,new_project:work_week,New Project > Work Week,There are two choices; a 5 Day Work Week or a 7 Day Work Week. Change this any time and all the work day calculations will adjust automatically.,2022-01-06 00:45:25,2022-01-06 13:19:22
87,dashboard,new_project:mode,New Project > Mode,"The Mode of the project can be Open, On Hold, Cancelled, Complete and when Closed, will appear in the folder of Closed Projects. No further notifications.",2022-01-06 00:45:25,2024-01-17 04:35:30
88,dashboard,new_project:cost_center,New Project > Cost Center,An optional field to be used to indicate the budget code or cost centre to be used for this project.,2022-01-06 00:45:25,2022-01-06 13:23:41
89,dashboard,new_project:dept_req_project,New Project > Dept Req Project,"Indicate the area, group or department that is requesting this project. An optional input.",2022-01-06 00:45:25,2022-01-06 13:25:02
90,dashboard,new_project:target_implementation_date,New Project > Target Implementation Date,"An optional date, typically representing the timing for any computer system changes to be implemented for the use of the organization. The project may itself finish but the benefits of the project may not be able to be implemented until a later date.",2022-01-06 00:45:25,2022-01-06 13:32:49
91,project_info,original_end_date,Original End Date,"The Original End Date is normally the projected end date at the time the project plan/schedule was approved. To keep track of the magnitude of any changes once the project is underway, don't change this date. Use the Approved Revised End Date for the date change.",2022-01-06 00:45:25,2022-06-15 12:28:14
92,project_info,original_work_days,Original Work Days,A calculated field based on the Project Start Date and the Original Project End Date and the choice of a 5 Day or 7 Day Work Week.,2022-01-06 00:45:25,2022-01-06 13:37:46
93,project_info,approved_revised_budget,Approved Revised Budget,This is a manual entry to track a comparison between the Original Budget and any changes made during the project.,2022-01-06 00:45:25,2022-01-06 13:40:36
94,project_info,activity_timeline,Activity Timeline,Traxidy records all the important changes and the date in the Activity Timeline for easy reference at any time.,2022-01-06 00:45:25,2022-01-06 13:42:50
95,aid,table:owner,Table > Owner,It is important that each Action have a single person who is responsible to the team to provide updates and complete the action item. Provide these Owners with CONTRIBUTOR Access so they can use Traxidy to update (only) their action items on their own time.,2022-01-06 00:45:25,2022-01-07 11:52:52
96,aid,table:progress,Table > Progress,The % amount of the Progress ON THE ACTION as reported by the Owner. Indicate from 0% to 100%. The record of the changes to the Progress is part of the historic updates/record.,2022-01-06 00:45:25,2022-01-08 07:19:46
97,aid,table:last_updated,Table > Last Updated,A system generated date indicating the last time anything about the item was changed.,2022-01-06 00:45:25,2022-01-07 11:57:18
98,aid,new_action:priority,New Action > Priority,This is the Priority of the ISSUE or work item and how important this is to be handled in the project.,2022-01-06 00:45:25,2022-03-23 05:41:18
99,aid,new_action:progress,New Action > Progress,The % amount of the Progress ON THE ACTION as reported by the Owner. Indicate from 0% to 100%. The record of the changes to the Progress is part of the historic updates/record.,2022-01-06 00:45:25,2022-01-08 07:19:24
100,aid,new_action:decision_made,New Action > Decision Made,"Indicate if a key Decision has been made as part of this Action. This is charted for you and is easily referred to at any time. If a decision has been made, be sure to update the Action Description record with the details of the Decision Made, and who made it and why.",2022-01-06 00:45:25,2022-01-08 07:24:37
101,aid,info:action_update,Info > Action Update,Enter the latest information regarding work to complete the Action. If a Decision has been made note the Who & What was Decided in this area.,2022-01-06 00:45:25,2022-01-12 10:20:33
102,aid,info:decision_made,Info > Decision Made,Set to Yes if you want to record a Decision made affecting the project. This will be recorded with the Action & on the Decisions Chart & can be found at any time.,2022-01-06 00:45:25,2022-01-12 10:23:20
103,aid,info:progress,Info > Progress,"Choose a percentage of the amount of work being done, that has already been completed.",2022-01-06 00:45:25,2022-08-04 08:14:07
104,gyr,list:key_project_constraints,List > Key Project Constraints,"The three main project constraints are shown with options for other areas that can be monitored and reported, in the Additional Areas of Focus",2022-01-06 00:45:25,2022-03-04 12:43:29
105,gyr,list:additional_key_constraints,List > Additional Key Constraints,"Choose key areas in this project that you would want to monitor, track and make visible to the key stakeholders. Simply add status GYR and comments and the history is captured with each change. Only those you set, will show in the Status Report.",2022-01-06 00:45:25,2022-01-14 09:37:58
106,gyr,list:weight,List > Weight,The percentage for each Key Constraint listed here is set in the Project Information Area and cannot be edited on this screen.,2022-01-06 00:45:25,2022-01-14 09:09:24
107,gyr,list:comments,List > Comments,Provide Status Comments to describe why the Constraint has been given a specific GYR color. Typically comments are needed if the Current Status color is Yellow or Red.,2022-01-06 00:45:25,2022-01-14 09:10:32
108,status,widget:milestones,Widget > Milestones,The Milestone is the brief description of a key part of the project and the single day in the project when it is to happen or finish or start. Track the status color of the milestone for the status report. This is not an extensive list. Typically use from 4 to 8 Milestones.,2022-01-06 00:45:25,2022-01-12 11:09:37
109,status,button:save_to_status_report_history,Button > Save To Status Report History,"With this button, Traxidy keeps track of all status reports for easy reference over time. See the Status Report History tab at the top of this screen.",2022-01-06 00:45:25,2022-01-12 11:13:42
110,status,tab:status_report_history,Tab > Status Report History,This tab shows all the saved status reports for easy reference over time. See the save to Status Report History button at the bottom of this screen.,2022-01-06 00:45:25,2022-01-12 11:15:13
111,changes,widget:work_days_approved,Widget > Work Days Approved,"Work Days Approved are a result of the Current End Date of the project and the Project Start Date considering the number of work days (5 or 7 in settings) for each week.
Any Approved Change to the Project End Date/Approved Revised End Date is made in the Project Information area.",2022-01-06 00:45:25,2022-01-12 11:26:43
112,changes,widget:time_duration_complete,Widget > Time Duration Complete,The Time Duration Complete is the percentage of time that has gone by since the Project Start Date compared to today's date and the Project End Date. The system calculation uses the number of Work Days per week (5 or 7) from Project Settings.,2022-01-06 00:45:25,2022-01-12 11:22:12
113,changes,widget:work_days_to_date,Widget > Work Days To Date,Work Days To Date indicates the number of work days since the Project Start Date to today.,2022-01-06 00:45:25,2022-01-12 11:23:12
114,changes,widget:work_days_remaining,Widget > Work Days Remaining,"Work Days Remaining indicates the number of work days remaining from today until the end of the project, as determined by the current Project End Date or Approved Revised End Date. Change dates in the Project Information Area.",2022-01-06 00:45:25,2022-01-12 11:26:06
115,changes,widget:approved_revised_end_date,Widget > Approved Revised End Date,It is important to ensure the Approved Revised End Date of the project reflects the number of days shown in the Approved Changes as shown on this page.,2022-01-06 00:45:25,2022-01-12 11:28:15
116,changes,new_change:dept_requesting_change,New Change > Dept Requesting Change,If there is a specific department that is driving the need for this change indicate it here. It may be important to track how often one area is responsible for the need for a change.,2022-01-06 00:45:25,2022-05-04 06:13:11
117,aid,info:insert_hyperlink,Info > Insert Hyperlink,Hyperlink for associated folder/file related to the action or issue.,2022-04-14 10:55:42,2022-04-14 10:55:42
118,dashboard,table:pm_estimate_of_work_complete,Table > EST. of Work Complete,This is input directly by the Project Manager estimating the current percentage of work complete to date.,2021-11-04 12:23:38,2024-01-17 04:38:14
119,dashboard,table:pm_estimate_of_work_complete,Table > EST. of Work Complete,Help text for EST. of Work Complete,2021-11-04 12:23:38,2022-07-07 08:06:51
